question_text,keywords,question_type
Describe a time you had to adjust to major organizational changes.,,Non-Technical
How do you handle unexpected changes in project requirements?,,Non-Technical
Share an example of adapting to new technology quickly.,,Non-Technical
How do you maintain productivity in uncertain situations?,,Non-Technical
Describe a time you worked in an unfamiliar environment.,,Non-Technical
How do you approach learning new processes?,,Non-Technical
Share an experience of adapting to cultural differences.,,Non-Technical
How do you handle sudden priority shifts?,,Non-Technical
Describe a time you had to change your communication style.,,Non-Technical
How do you stay flexible under tight deadlines?,,Non-Technical
Share an example of adapting to new team dynamics.,,Non-Technical
How do you manage stress during transitions?,,Non-Technical
Describe a time you had to master new skills quickly.,,Non-Technical
How do you handle ambiguous job responsibilities?,,Non-Technical
Share an experience of working with constantly changing tools.,,Non-Technical
