question_text,keywords,question_type
Describe a successful conflict resolution experience.,,Non-Technical
How do you handle disagreements with superiors?,,Non-Technical
Share an example of mediating team conflicts.,,Non-Technical
How do you approach personality clashes at work?,,Non-Technical
Describe a time you turned conflict into collaboration.,,Non-Technical
How do you prevent small disagreements from escalating?,,Non-Technical
Share an experience of resolving client conflict.,,Non-Technical
How do you handle criticism during conflicts?,,Non-Technical
Describe a time you admitted fault in a conflict.,,Non-Technical
How do you maintain professionalism in heated situations?,,Non-Technical
Share an example of cultural conflict resolution.,,Non-Technical
How do you balance different viewpoints in conflicts?,,Non-Technical
Describe a time you implemented process changes to prevent conflicts.,,Non-Technical
How do you handle conflicts arising from miscommunication?,,Non-Technical
Share an experience of resolving inter-departmental conflict.,,Non-Technical
